{
  "manifest": {
    "language_code": "ro",
    "language_name": "Romanian",
    "native_name": "Română",
    "version": "ro-v0.2.10-public-beta",
    "status": "review",
    "fallback": "en",
    "last_updated": "2026-05-15",
    "author": "Voila contributors",
    "notes": "Expanded Romanian sample language pack for schema and validator demonstration only."
  },
  "ui": {
    "app.title": "Voila!",
    "app.subtitle": "Transformă documentele în lecții ușor de învățat.",
    "button.start": "Începe",
    "button.cancel": "Anulează",
    "button.save": "Salvează",
    "button.export": "Exportă",
    "button.import": "Importă",
    "button.open": "Deschide",
    "button.close": "Închide",
    "button.retry": "Reîncearcă",
    "button.back": "Înapoi",
    "button.next": "Următorul",
    "button.previous": "Anteriorul",
    "nav.home": "Acasă",
    "nav.settings": "Setări",
    "nav.documents": "Documente",
    "nav.lessons": "Lecții",
    "nav.export": "Export",
    "status.ready": "Gata",
    "status.processing": "Se procesează...",
    "status.loading": "Se încarcă...",
    "status.completed": "Finalizat",
    "status.failed": "Eșuat"
  },
  "messages": {
    "message.saved": "Modificările au fost salvate.",
    "message.export_complete": "Exportul a fost finalizat.",
    "message.file_loaded": "Fișierul a fost încărcat.",
    "message.import_complete": "Importul a fost finalizat.",
    "message.processing_started": "Procesarea a început.",
    "message.processing_complete": "Procesarea a fost finalizată.",
    "message.items_processed": "Au fost procesate {count} elemente.",
    "message.exported_lessons": "Au fost exportate {count} lecții.",
    "warning.unsaved_changes": "Ai modificări nesalvate.",
    "warning.large_file": "Fișierul este mare și poate dura mai mult procesarea.",
    "warning.incomplete_content": "Conținutul pare incomplet.",
    "error.file_not_supported": "Acest tip de fișier nu este acceptat.",
    "error.file_too_large": "Fișierul este prea mare.",
    "error.processing_failed": "Procesarea a eșuat.",
    "error.export_failed": "Exportul a eșuat.",
    "error.invalid_language_pack": "Pachetul de limbă nu este valid.",
    "error.field_required": "{field} este obligatoriu.",
    "lesson.progress": "Lecția {current} din {total}"
  },
  "feedback": {
    "feedback.correct": "Corect!",
    "feedback.try_again": "Încearcă din nou.",
    "feedback.good_progress": "Progresezi bine.",
    "feedback.grammar_hint": "Verifică forma gramaticală înainte de a răspunde.",
    "feedback.review_needed": "Merită să revizuiești această parte.",
    "feedback.almost_correct": "Aproape corect.",
    "feedback.check_spelling": "Verifică ortografia.",
    "feedback.check_word_order": "Verifică ordinea cuvintelor.",
    "feedback.vocabulary_hint": "Gândește-te la vocabularul potrivit.",
    "feedback.keep_practicing": "Continuă să exersezi."
  },
  "glossary": {
    "term.pdf": "PDF",
    "term.lesson": "lecție",
    "term.exercise": "exercițiu",
    "term.translation": "traducere",
    "term.grammar": "gramatică",
    "term.vocabulary": "vocabular",
    "term.feedback": "feedback",
    "term.document": "document",
    "term.page": "pagină",
    "term.paragraph": "paragraf",
    "term.question": "întrebare",
    "term.answer": "răspuns",
    "term.progress": "progres",
    "term.language_pack": "pachet de limbă",
    "term.placeholder": "substituent",
    "term.schema": "schemă"
  }
}
