{
  "manifest": {
    "language_code": "en",
    "language_name": "English",
    "native_name": "English",
    "version": "en-v0.2.20-public-beta",
    "status": "review",
    "fallback": "ro",
    "last_updated": "2026-05-15",
    "author": "Voila contributors",
    "notes": "Core English language pack promoted from reviewed sample pack."
  },
  "ui": {
    "app.title": "Voila!",
    "app.subtitle": "Turn documents into easy-to-learn lessons.",
    "button.start": "Start",
    "button.cancel": "Cancel",
    "button.save": "Save",
    "button.export": "Export",
    "button.import": "Import",
    "button.open": "Open",
    "button.close": "Close",
    "button.retry": "Retry",
    "button.back": "Back",
    "button.next": "Next",
    "button.previous": "Previous",
    "nav.home": "Home",
    "nav.settings": "Settings",
    "nav.documents": "Documents",
    "nav.lessons": "Lessons",
    "nav.export": "Export",
    "status.ready": "Ready",
    "status.processing": "Processing...",
    "status.loading": "Loading...",
    "status.completed": "Completed",
    "status.failed": "Failed"
  },
  "messages": {
    "message.saved": "Changes have been saved.",
    "message.export_complete": "Export is complete.",
    "message.file_loaded": "The file has been loaded.",
    "message.import_complete": "Import is complete.",
    "message.processing_started": "Processing has started.",
    "message.processing_complete": "Processing is complete.",
    "message.items_processed": "Processed {count} items.",
    "message.exported_lessons": "Exported {count} lessons.",
    "warning.unsaved_changes": "You have unsaved changes.",
    "warning.large_file": "The file is large and may take longer to process.",
    "warning.incomplete_content": "The content appears to be incomplete.",
    "error.file_not_supported": "This file type is not supported.",
    "error.file_too_large": "The file is too large.",
    "error.processing_failed": "Processing failed.",
    "error.export_failed": "Export failed.",
    "error.invalid_language_pack": "The language pack is not valid.",
    "error.field_required": "{field} is required.",
    "lesson.progress": "Lesson {current} of {total}",
    "ui.upload_pdf": "Upload PDF",
    "ui.choose_file": "Choose File",
    "ui.generated": "Generated",
    "ui.source_mode": "Source Mode",
    "ui.generate_course": "Generate course",
    "ui.open_course": "Open course",
    "ui.figures": "Figures",
    "ui.edit_crops": "Edit crops",
    "ui.study": "Study",
    "ui.review_weak": "Review weak",
    "ui.progress": "Progress",
    "ui.logs": "Logs",
    "ui.delete_from_library": "Delete from library",
    "ui.back": "Back",
    "ui.tools": "Tools",
    "ui.course": "Course",
    "ui.lessons": "Lessons",
    "ui.library": "Library",
    "ui.course_tools": "Course Tools",
    "ui.quick_tools": "Quick Tools",
    "ui.study_mode": "Study mode",
    "ui.review_ocr_text": "Review OCR Text",
    "ui.review_concepts": "Review Concepts",
    "ui.review_study_concepts": "Review Study Concepts",
    "ui.correct_ocr_text": "Correct OCR Text",
    "ui.continue_study": "Continue Study",
    "ui.toggle_theme": "Toggle theme",
    "ui.save_title_override": "Save title override",
    "ui.save_page_correction": "Save page correction",
    "ui.save_reviewed_page": "Save reviewed page",
    "ui.save_as_needs_review": "Save as needs review",
    "ui.apply_corrected_ocr": "Apply corrected OCR to pages.json",
    "ui.fit_width": "Fit width",
    "message.choose_pdf_helper": "Choose a PDF from your computer. It will be saved locally in data/input.",
    "message.no_pdf_files_found": "No PDF files found. Put a PDF in data/input, then refresh this page.",
    "message.open_course_description": "Read the generated course with navigation.",
    "message.lessons_description": "Choose a lesson, read it, then study only that lesson.",
    "message.study_mode_description": "Practice questions generated from the course.",
    "message.review_ocr_text_description": "Correct OCR text page by page.",
    "message.review_concepts_description": "Correct lesson and concept titles.",
    "message.edit_crops_description": "Manually edit figure crops.",
    "message.figures_description": "View extracted figures.",
    "message.progress_description": "View study progress.",
    "message.return_to_library_description": "Return to the main course library.",
    "message.source_mode_description": "No translation, local processing, original PDF text preserved.",
    "message.apply_corrected_ocr_warning": "Apply corrected OCR text to pages.json.",
    "status.uploaded": "Uploaded",
    "status.not_generated_yet": "Not generated yet",
    "status.no_suspicious_pages_detected": "No suspicious pages detected.",
    "status.focused_concept": "Focused concept",
    "status.attempts": "Attempts",
    "status.status": "Status",
    "status.study_coverage": "Study coverage",
    "status.overall_mastery": "Overall mastery",
    "status.concept_status": "Concept status",
    "status.missing_pdf_name": "Missing PDF name",
    "status.no_ocr_pages_found": "No OCR pages found",
    "status.rebuild_complete": "Rebuild complete",
    "status.rebuild_failed": "Rebuild failed",
    "status.save_title_override_failed": "Save title override failed",
    "status.save_ocr_text_failed": "Save OCR text failed",
    "error.missing_pdf_name": "Missing PDF name",
    "error.no_ocr_pages_found": "No OCR pages found",
    "error.course_html_not_found": "Course HTML not found",
    "error.figures_html_not_found": "Figures HTML not found",
    "error.page_not_found": "Page not found",
    "error.pdf_not_found": "PDF not found",
    "error.not_found": "Not found",
    "error.only_pdf_files_supported": "Only PDF files are supported",
    "error.save_title_override_failed": "Save title override failed",
    "error.save_ocr_text_failed": "Save OCR text failed",
    "message.run_ocr_first": "Run OCR first",
    "message.no_log_file_found_yet": "No log file found yet",
    "ui.heading.home": "Voila!",
    "ui.heading.review": "Voila! Review",
    "ui.heading.review_question": "Review question",
    "ui.heading.no_review_questions": "No review questions available",
    "ui.heading.review_weak_concepts": "Voila! Review weak concepts",
    "ui.heading.progress": "Voila! Progress",
    "ui.heading.progress_dashboard": "Voila! Progress Dashboard",
    "ui.heading.crop_editor_not_started": "Crop Editor did not start",
    "ui.heading.source_page": "Source page",
    "ui.heading.editable_ocr_text": "Editable OCR text",
    "ui.heading.suspicious_pages": "Suspicious pages",
    "ui.button.save_page_correction": "Save page correction",
    "ui.button.save_reviewed_page": "Save reviewed page",
    "ui.button.save_as_needs_review": "Save as needs review",
    "ui.button.apply_corrected_ocr": "Apply corrected OCR to pages.json",
    "ui.link.back": "Back",
    "ui.link.next_review": "Next review",
    "ui.link.study": "Study",
    "ui.link.progress": "Progress",
    "ui.link.continue_study": "Continue Study",
    "ui.link.course_tools": "Course tools",
    "ui.link.top": "Top",
    "ui.link.bottom": "Bottom",
    "ui.link.back_to_voila": "Back to Voila",
    "ui.link.reload": "Reload",
    "ui.link.concepts": "Concepts",
    "ui.link.course": "Course",
    "ui.link.review_ocr": "Review OCR",
    "ui.label.correct_concept_title": "Correct concept title"
  },
  "feedback": {
    "feedback.correct": "Correct!",
    "feedback.try_again": "Try again.",
    "feedback.good_progress": "You are making good progress.",
    "feedback.grammar_hint": "Check the grammar form before answering.",
    "feedback.review_needed": "This part is worth reviewing.",
    "feedback.almost_correct": "Almost correct.",
    "feedback.check_spelling": "Check the spelling.",
    "feedback.check_word_order": "Check the word order.",
    "feedback.vocabulary_hint": "Think about the right vocabulary.",
    "feedback.keep_practicing": "Keep practicing."
  },
  "glossary": {
    "term.pdf": "PDF",
    "term.lesson": "lesson",
    "term.exercise": "exercise",
    "term.translation": "translation",
    "term.grammar": "grammar",
    "term.vocabulary": "vocabulary",
    "term.feedback": "feedback",
    "term.document": "document",
    "term.page": "page",
    "term.paragraph": "paragraph",
    "term.question": "question",
    "term.answer": "answer",
    "term.progress": "progress",
    "term.language_pack": "language pack",
    "term.placeholder": "placeholder",
    "term.schema": "schema"
  }
}
